<xs:schema xmlns:xs="http://www.w3.org/2001/XMLSchema">

    <xs:element name="authentication">
        <xs:complexType>
            <xs:sequence>
                <xs:element name="user" maxOccurs="unbounded">
                    <xs:complexType>
                        <xs:sequence>
                            <xs:element name="username" type="xs:string"/>
                            <xs:element name="password" type="xs:string"/>
                            <xs:element name="role">
                                <xs:simpleType>
                                    <xs:restriction base="xs:string">
                                        <xs:enumeration value="Admin"/>
                                        <xs:enumeration value="Teacher"/>
                                        <xs:enumeration value="Student"/>
                                        <!-- Additional roles can be added here -->
                                    </xs:restriction>
                                </xs:simpleType>
                            </xs:element>
                        </xs:sequence>
                    </xs:complexType>
                </xs:element>
            </xs:sequence>
        </xs:complexType>
    </xs:element>

</xs:schema>
